{
  "stage": "security",
  "schema_version": "1.0",
  "inputs_consumed": [
    {
      "stage": "plan",
      "handoff_sha256": "78cb95758b9dacd9f30c491fba071772d5b8ce7f93d37aa57c16bbd2ea645997"
    },
    {
      "stage": "security-M1-T60",
      "handoff_sha256": "e950bb39a0fa0a6f7af8d1e34acb19ee68864a3b63f0b38247da1c8269e65bcc"
    }
  ],
  "status": "fail",
  "open_questions": [
    {
      "id": "OQ-SEC-02",
      "text": "SEC-019 - EMAIL_HASH_PEPPER_RETIRED is still the published placeholder 'v1:change-me-in-every-real-environment' (identical to tracked .env.example:41), so every identity_account.email_hash row stored with the 'v1$' prefix was computed under a pepper any reader of this repository knows. Those rows CANNOT be re-hashed, because email_encrypted is NULL for them (SEC-020) and HMAC is one-way. A human must decide between two options, both of which have a real cost: (a) delete or quarantine every v1$ identity_account row - this destroys real accounts and those students must re-register; or (b) accept the membership-confirmation exposure in writing, on the record, with a named owner. This agent cannot choose, cannot waive it, and has not.",
      "owner": "gurkanwaldeep",
      "blocking": true
    },
    {
      "id": "OQ-SEC-03",
      "text": "SEC-002 and SEC-021 - the single environment that talks to the live Supabase instance is configured as a development environment: DATABASE_SSL=require (unauthenticated TLS, no CA pinned), EMAIL_PROVIDER=console (real OTPs and raw addresses to stdout), EMAIL_ENCRYPTION_KEY empty and NODE_ENV=development (which is what disarms the boot guards written for T60's SEC-006 and SEC-011). Each code remedy from T60 landed and each is bypassed by configuration. A human must decide whether to fix the configuration or to split dev and production environments; the M2 gate cannot pass while a live database is reached this way.",
      "owner": "gurkanwaldeep",
      "blocking": true
    },
    {
      "id": "OQ-SEC-04",
      "text": "Tool substitution - gitleaks, osv-scanner and trivy are all absent from this machine and binary downloads have failed here before, so the mandated secret and SCA scanners could not be run locally. detect-secrets@1.5.0 (worktree only, NOT git history) and npm@10.9.2 audit (npm advisory database only) were substituted. This is partly compensated: the CI secrets-scan job runs the real gitleaks/gitleaks-action@v2 and succeeded on commit 80b1b57, which is this run's HEAD. Confirm whether that job scans full history or only the pushed commit range, and whether the environment should carry these binaries before T48 re-executes every signal from scratch.",
      "owner": "gurkanwaldeep",
      "blocking": false
    }
  ],
  "waivers_cited": [],
  "tool_runs": [
    {
      "tool": "semgrep",
      "version": "1.172.0",
      "exit_code": 0,
      "invocation": "semgrep.exe scan --config auto --json --output .pipeline/sec/semgrep-T62.json .",
      "report_path": ".pipeline/sec/semgrep-T62.json"
    },
    {
      "tool": "detect-secrets (SUBSTITUTE for gitleaks - absent)",
      "version": "1.5.0",
      "exit_code": 0,
      "invocation": "python -m detect_secrets scan --all-files > .pipeline/sec/detect-secrets-T62.json",
      "report_path": ".pipeline/sec/detect-secrets-T62.json"
    },
    {
      "tool": "git history secret search (SUPPLEMENT - detect-secrets does not read history)",
      "version": "git 2.x",
      "exit_code": 0,
      "invocation": "git log --all --diff-filter=A -- '*.env' .env server/.env client/.env; git log --all -S<live-secret> for EMAIL_HASH_PEPPER_ACTIVE, SESSION_SIGNING_KEY, DATABASE_URL password",
      "report_path": ".pipeline/sec/history-secret-search-T62.txt"
    },
    {
      "tool": "gitleaks via CI (MANDATED TOOL - ran remotely, not locally)",
      "version": "gitleaks-action@v2",
      "exit_code": 0,
      "invocation": "GitHub Actions job 'secrets-scan' on run 31521354238, commit 80b1b57 (this run's HEAD), conclusion=success",
      "report_path": "https://github.com/gurkanwaldeep927/murmur/actions/runs/31521354238"
    },
    {
      "tool": "npm audit (SUBSTITUTE for osv-scanner - absent; trivy also absent)",
      "version": "10.9.2",
      "exit_code": 1,
      "invocation": "npm audit --json (root/server lockfile) and (cd client && npm audit --json), plus --omit=dev re-runs of both",
      "report_path": ".pipeline/sec/npm-audit-server-T62.json, .pipeline/sec/npm-audit-client-T62.json, .pipeline/sec/npm-audit-server-prod-T62.json, .pipeline/sec/npm-audit-client-prod-T62.json"
    }
  ],
  "findings": [
    {
      "id": "SEC-002",
      "severity": "high",
      "category": "A02:2021 Cryptographic Failures - unauthenticated TLS to the database",
      "location": "server/src/db/pool.ts:28; .env DATABASE_SSL=require; .env DATABASE_SSL_CA (empty)",
      "evidence": "T62 re-verification of the T60 finding. The CODE fix landed and defaults safely: config/index.ts:161-162 derives 'verify-full' for any non-local host. The DEPLOYED configuration overrides it - the live .env sets DATABASE_SSL=require, which pool.ts:28 maps to {rejectUnauthorized:false}, and DATABASE_SSL_CA is empty so no CA is pinned either. DATABASE_URL host is aws-0-ap-southeast-2.pooler.supabase.com, i.e. a remote managed host reached over the public internet. Channel is encrypted but the peer is never authenticated, so an active machine-in-the-middle succeeds: it obtains the database password and every row - identity_account.email_hash, question/answer bodies, grievance_report contents. pool.ts:14-17 documents this exact property ('it encrypts the channel but accepts any certificate'). Env values were read by digest/enum comparison; no secret was printed. DSN carries no sslmode= (checked), so the explicit option is what reaches the socket.",
      "provenance": "semgrep@1.172.0:problem-based-packs.insecure-transport.js-node.bypass-tls-verification.bypass-tls-verification (native WARNING) + manual config re-verification (security-audit skill step 3, storage/transport class)",
      "fix_hint": "Download prod-ca-2021.crt from the Supabase dashboard into server/certs/, set DATABASE_SSL_CA to it and DATABASE_SSL=verify-full (or unset DATABASE_SSL entirely and let the derived default apply). Restart and confirm a query succeeds."
    },
    {
      "id": "SEC-019",
      "severity": "high",
      "category": "A02:2021 Cryptographic Failures - identity hashes retained under a published pepper",
      "location": ".env EMAIL_HASH_PEPPER_RETIRED; .env.example:41; server/src/shared/email-identity.ts:85-92,121-124; server/src/config/index.ts:188",
      "evidence": "Residual of T60 SEC-001, which was recorded as fixed. The ACTIVE pepper is genuinely rotated: its version prefix is now v2 and it carries no placeholder marker, and requiredSecret() at config/index.ts:32-46 refuses to boot on a placeholder. But EMAIL_HASH_PEPPER_RETIRED is still 'v1:change-me-in-every-real-environment' - byte- identical to the value committed in tracked .env.example:41 - and it is loaded by optional() at config/index.ts:188, which applies NO placeholder guard. hashNormalizedEmail() (email-identity.ts:103-106) writes new rows under v2, so new accounts are safe; candidateHashes() (email-identity.ts:121-124) keeps v1 live for lookups. Every identity_account.email_hash row still stored with the 'v1$' prefix was therefore computed with a secret any reader of this repository knows. Campus addresses are low-entropy and enumerable, so that reduces the keyed HMAC to a membership- confirmation oracle against the product's core anonymity promise (RR-7/RR-13). Reachability is narrower than at T60: migration 008 revoked the anon/authenticated grants, so the hashes are no longer readable by an anonymous PostgREST caller - exploitation now needs database access. That is why this is high and not critical. No rehash or backfill tool exists (server/scripts/ contains only admin-delete-identity.ts), and re-hashing verified accounts is impossible because email_encrypted is NULL for them (SEC-020).",
      "provenance": "manual re-verification of T60 SEC-001 (security-audit skill step 3, secrets-outside-git-history class); digest/marker comparison of .env against tracked .env.example:41",
      "fix_hint": "Decide and record what happens to the pre-rotation rows: either delete/quarantine every identity_account whose email_hash starts with 'v1$', or accept the exposure in writing with a named owner. Then clear EMAIL_HASH_PEPPER_RETIRED so the published pepper is no longer a live lookup key, and extend requiredSecret() to cover the RETIRED variable so this cannot recur."
    },
    {
      "id": "SEC-021",
      "severity": "high",
      "category": "A09:2021 Security Logging Failures - live OTP and raw email written to stdout",
      "location": "server/src/modules/notification/email-provider.ts:59-73 (console.log at :66 and :72); .env EMAIL_PROVIDER=console; .env NODE_ENV=development",
      "evidence": "Residual of T60 SEC-006. The code remedy landed: email-provider.ts:42-43 throws when a non-delivering provider is selected under a production NODE_ENV. That guard is keyed on NODE_ENV, and the live .env sets NODE_ENV=development while DATABASE_URL points at the live Supabase instance holding real data - so the guard permits the console provider against production data. ConsoleEmailProvider.sendVerification (email-provider.ts:66) then console.logs the raw recipient address and the raw verification OTP on one line. The OTP is a live account-takeover credential and the raw address is the one identifier the whole product exists to keep out of reach; stdout is what the host's log aggregation captures, and shared/logger.ts's REDACT_PATHS cannot help because this is a direct console.log, not a pino field.",
      "provenance": "manual re-verification of T60 SEC-006 (security-audit skill step 3, secrets-in-config class); config read from .env by key enumeration",